{
  "api_version": "1",
  "operation": "ukma.memory.page_out.v1",
  "context": {
    "request_id": "x",
    "trace_id": "x",
    "scope": {
      "tenant_id": "x",
      "project_id": "x"
    },
    "principal_id": "x",
    "scopes": [],
    "consistency": "eventual"
  },
  "input": {
    "block": {
      "id": "x",
      "kind": "working",
      "revision": "x"
    },
    "policy_id": "x"
  }
}
